id,bid,user_id,用户昵称,微博正文,头条文章url,发布位置,艾特用户,话题,转发数,评论数,点赞数,发布时间,发布工具,微博图片url,微博视频url,retweet_id
4.80939E+15,M3WfrqQJZ,2100715942,李E讲管理深落地,【李E讲股权】39、股东可以约定不按实缴出资比例分红吗?可以。股权分红属于股东意思自治的范畴。根据《公司法》第三十四条规定，只要全体股东一致同意，可以约定不按出资比例分红。股东可以通过【协议、股东决议、制定章程】等方式确定股权分红的方式；但需要注意的是，股权分红涉及每位股东的财产权利，应由每位股东自主决定和处分，无论通过何种方式均须经过全体股东同意。???#股权##股权激励##股权设计##教育##管理##企业管理##企业家##成功##赚钱##李E##冠军联盟##你认为人生的终极意义是什么##爱情需要计较谁付出多少吗#,,西安・1号甲写(万达广场),,"股权,股权激励,股权设计,教育,管理,企业管理,企业家,成功,赚钱,李E,冠军联盟,你认为人生的终极意义是什么,爱情需要计较谁付出多少吗",0,0,0,2022/9/2 23:05,iPhone客户端,['https://wx2.sinaimg.cn/large/7d3661a6ly1h5snsn1bn7j21831qdkew.jpg'],,
4.80938E+15,M3W7go6OV,6567039332,Steven建玮,最好的教育是言传身教。父母是孩子的第一任老师。#教育#父母#老师#言传身教#孩子LSteven建玮的微博视频,,,,"教育 ,老师 ",0,0,0,2022/9/2 22:45,iPhone,,"http://f.video.weibocdn.com/o0/6niLmOpGlx07YUc6LfKg01041200kpY00E010.mp4?label=mp4_720p&template=720x1280.24.0&ori=0&ps=1BVp4ysnknHVZu&Expires=1665151451&ssig=g4kWkB1OBK&KID=unistore,video",
4.80938E+15,M3W6ICqkR,7672331441,北京论文赵老师,"?高职院校中文核心发不了怎么办？现在大多高职院校、事业单位等不复合发中文核心的资质，在读博士、研究生等也要导师一作，所以可以选择国际核心Sci，各个方向可以结合计算机投刊??特点其一：正常2个月左右收到录用，4个月上线，6个月检索。核心中的领跑者,含金量高；?其二：不用担心因为英文不好，不敢发，可以润色，学校看的还是你的核心学术。评职称、毕业论文所需【核心期刊】【普刊】【国内外核心】【著作】【课题】【专利】等如下：1.SCI，SSCI，ISTP，EI，南核，北核2.发明专利实用新型专利3.国家级课题申请4.各专业普刊、学报、核心论文5.硕论、博论6.学术专著、教材出版赵编：（+VX:784293200）????????????毕业论文#高校##教育##医学##评职称#绿洲",,,,"高校,教育,医学,评职称",0,0,0,2022/9/2 22:44,荣耀60 SE 5G,['https://wx4.sinaimg.cn/large/008nejTjly1h5sn6ihxkwj30n8119dj2.jpg'],,
4.80904E+15,M3N6Lnh1k,6193581962,窦昆老师,看人看事看其所长，凡事都往好处想#教育##思维##为人处事#L窦昆老师的微博视频,,,,"教育,思维,为人处事",0,0,0,2022/9/1 23:49,iPhone客户端,,"http://f.video.weibocdn.com/o0/GAIkjxYElx07YSFEae2Y01041200fIv70E010.mp4?label=mp4_720p&template=720x1280.24.0&ori=0&ps=1BVp4ysnknHVZu&Expires=1665151464&ssig=u5C3jETJYH&KID=unistore,video",
4.80904E+15,M3N60qtgI,5906142713,托管大师,巧妙利用两个方法方法让孩子主动带领家长参加家长会#托管##创业##教育##托管机构#L托管大师的微博视频,,,,"托管,创业,教育,托管机构",0,0,0,2022/9/1 23:47,iPhone客户端,,"http://f.video.weibocdn.com/o0/5L1AWTuKlx07YSFw9fQI010412009uIT0E010.mp4?label=mp4_720p&template=720x1280.24.0&ori=0&ps=1BVp4ysnknHVZu&Expires=1665151464&ssig=GmFWB27rBq&KID=unistore,video",
4.80904E+15,M3N5zhDoc,5602618108,悦啊悦悦悦老大,考研人的金九银十#教育##考研##333教育综合#,,,,"教育,考研,333教育综合",0,0,1,2022/9/1 23:46,iPad客户端,"['https://wx3.sinaimg.cn/large/0067a0Ucly1h5rjcgv13aj30zk1bejye.jpg', 'https://wx1.sinaimg.cn/large/0067a0Ucly1h5rjchdezfj30zk1bejzb.jpg', 'https://wx4.sinaimg.cn/large/0067a0Ucly1h5rjcgafycj30zk1betie.jpg', 'https://wx4.sinaimg.cn/large/0067a0Ucly1h5rjci2vclj30zi1bewm3.jpg', 'https://wx3.sinaimg.cn/large/0067a0Ucly1h5rjcikslwj30ty13htfi.jpg', 'https://wx3.sinaimg.cn/large/0067a0Ucly1h5rjciqrelj308c08cq32.jpg']",,
4.80904E+15,M3N5q84Jb,7646624789,晴晴看教育,#开学##教育#9月进入新学期，家长希望调整孩子作息的同时，也要注意改变自己和孩子的相处模式，比如晚上回家后放下手机，尽可能专心和孩子互动，哪怕是玩会儿游戏、陪读绘本、睡前夜话都可以，即使时间很短也能满足孩子的内心需求；临睡前，家长不要当着孩子的面刷手机，或是用Ipad放动画片哄睡，这样会适得其反。开学了，告别悠闲的暑假，如何和娃一起适应新学期。李瑞珍建议，家长不妨从“早睡”做起，从生活细节着手，帮孩子尽快调整生活状态。,,,,"开学,教育",0,0,0,2022/9/1 23:46,HUAWEI Mate 8,['https://wx2.sinaimg.cn/large/008luspTgy1h5rjcs5b05j30xc0len1j.jpg'],,
4.80904E+15,M3N3K55CZ,6293630356,月月的小小吉,#人生##教育#人生太过用力，是一种自我消耗听过这样一句话：“太过用力的面庞，往往扭曲，且丧失了原有的美感。”话虽扎心，却很真实。一个人，若太过追求完美，往往只会换来一地稀碎。,,,,"人生,教育",0,0,0,2022/9/1 23:42,iPhone客户端,['https://wx3.sinaimg.cn/large/006RVqL2gy1h5rj8hj81gj30fn0b5js8.jpg'],,
4.80903E+15,M3N0GoOUL,6114500067,雨林潇潇2401,新学年第一跑#教育#校园生活#神兽归笼#运动#开学季L雨林潇潇2401的微博视频,,莆田,,"教育,神兽归笼",0,2,0,2022/9/1 23:34,微博视频号,,"http://f.video.weibocdn.com/u0/obMzAIUkgx07YSECq5zG01041200hSD90E010.mp4?label=mp4_hd&template=960x460.25.0&ori=0&ps=1BVp4ysnknHVZu&Expires=1665151464&ssig=4C2U7gmy%2Fe&KID=unistore,video",
4.80903E+15,M3MSpDySC,1064144234,张岩与TOKELA与MOROCO,颜色好看。???20220901小蜜蜂采蜜集???#包装设计##设计##设计美学##平面设计##好设计共欣赏##原创设计##产品设计##艺术设计##设计秀##创意生活##设计小课堂##设计神器##遇见艺术##原创##艺术留学##品牌##品牌设计##标志设计##logo设计集##logo设计圈##品牌营销##潮流##潮流生活##我热爱的潮流设计##国潮##礼品##时尚##潮流艺术##教育##感受精致设计##设计师##艺考##美术生##家居设计##家居美学##我有一个家要设计##餐饮空间设计##设计师品牌#???,,,,"包装设计,设计,设计美学,平面设计,好设计共欣赏,原创设计,产品设计,艺术设计,设计秀,创意生活,设计小课堂,设计神器,遇见艺术,原创,艺术留学,品牌,品牌设计,标志设计,logo设计集,logo设计圈,品牌营销,潮流,潮流生活,我热爱的潮流设计,国潮,礼品,时尚,潮流艺术,教育,感受精致设计,设计师,艺考,美术生,家居设计,家居美学,我有一个家要设计,餐饮空间设计,设计师品牌",0,0,2,2022/9/1 23:14,iPhone 13 Pro Max,"['https://wx1.sinaimg.cn/large/3f6d8d6aly1h5ridkn3t8j20su0sugmf.jpg', 'https://wx1.sinaimg.cn/large/3f6d8d6aly1h5ridmkyooj20ku0tgjtg.jpg', 'https://wx3.sinaimg.cn/large/3f6d8d6aly1h5ridm228hj20ku0tgabp.jpg', 'https://wx4.sinaimg.cn/large/3f6d8d6aly1h5ridm8kygj20kt0tgmzp.jpg', 'https://wx4.sinaimg.cn/large/3f6d8d6aly1h5ridkxd0aj20ku0dygnd.jpg', 'https://wx4.sinaimg.cn/large/3f6d8d6aly1h5ridlm880j20g60p0jsw.jpg', 'https://wx1.sinaimg.cn/large/3f6d8d6aly1h5ridlicbkj20ku0t676c.jpg', 'https://wx1.sinaimg.cn/large/3f6d8d6aly1h5ridlt4xpj20ku0v941c.jpg', 'https://wx2.sinaimg.cn/large/3f6d8d6aly1h5ridl28wuj20iz0sg79i.jpg']",,
4.80902E+15,M3MLqtf0F,2284594891,星心泪雨心,历史#世界和平#诗词古风今韵#教育##愿你遇到的人都是温暖的##历史影像#L星心泪雨心的微博视频,,,,"世界和平,教育,愿你遇到的人都是温暖的,历史影像",0,0,0,2022/9/1 22:56,微博视频号,,"http://f.video.weibocdn.com/o0/tnHvamzqlx07YSC2pjW801041200kDNA0E010.mp4?label=mp4_720p&template=720x1280.24.0&ori=0&ps=1BVp4ysnknHVZu&Expires=1665151464&ssig=nyFteDhkox&KID=unistore,video",
4.80902E+15,M3MDZ0oBb,5780914766,杨涤-Lisa老师,下播后已经是万家灯火，回家路上遇到了特别爱唠嗑的司机，以为我是大厂刚下班的，上来就问：“今天怎么这么早收工啊？”原来996已经卷到午夜12点了[发呆]感谢这场直播背后所有小伙伴的辛苦付出，也不晓得具体有多少平台推流，反正有北京的朋友看到了[愉快]#阅读##教育##直播#,,杭州・杭州未来科技城国际会议中心,,"阅读,教育,直播",0,0,1,2022/9/1 22:38,iPhone客户端,"['https://wx3.sinaimg.cn/large/006je80Kgy1h5rhd1esl2j33402c0e82.jpg', 'https://wx1.sinaimg.cn/large/006je80Kgy1h5rhd2aibvj30wi1yc7bm.jpg', 'https://wx4.sinaimg.cn/large/006je80Kgy1h5rhd4x27rj335s2dc1ky.jpg', 'https://wx3.sinaimg.cn/large/006je80Kgy1h5rhdaf0tyj335s2dcu0y.jpg']",,
4.80901E+15,M3Mt5cSgx,3477716621,亨特契卡,强烈建议教育部聘请彭帮怀为教材审核员，还孩子们一片明媚蓝天#教育#彭帮怀#集结吧光合创作者##快手#@快手L小幸运??在东北的快手视频,,,快手,"教育 ,集结吧光合创作者 ,快手",0,0,0,2022/9/1 22:11,iPhone客户端,,http://www.kuaishou.com/rest/kd/partner/weibo/linkcard/video?p=3x5qtz6i734xfxi&a=3x3dk4nxt98sw2a&f=3x8tgguyy29qmsq&kpn=KUAISHOU&subBiz=BROWSE_SLIDE_PHOTO&shareChannel=weibo&shareMethod=card&shareObjectId=5249789871081860459&shareResourceType=PHOTO_OTHER&shareToken=X-4yt4hjtTDd71mZ,
4.82204E+15,M9fpCo4V7,6758528739,微羽殇璃茉,越是能轻易满足的，越是低级欲望#教育#家庭教育#父母课堂##快手#@快手L王纪琼心理教育的快手视频,,,快手,"教育 ,父母课堂 ,快手",0,0,0,2022/10/7 21:04,快手极速版,,http://www.kuaishou.com/rest/kd/partner/weibo/linkcard/video?p=3xejgwkcwbuitjm&a=3xyr8jjqcpqp7tw&f=3xtczpqb22458zq&kpn=NEBULA&subBiz=BROWSE_SLIDE_PHOTO&shareChannel=weibo&shareMethod=card&shareObjectId=5201376176820764932&shareResourceType=PHOTO_OTHER&shareToken=X-a6L7cafhPmu1kn,
4.82203E+15,M9f2EpuOC,5460266092,一只奶芙崽,想批评学生时：用反问句你觉得呢？你觉得你这样对嘛？如何不知不觉中教育学生：请Ta帮忙！真的要感谢的话，帮老师一个忙……真的觉得不好意思的话，帮同学一个忙……――――――――――――――――――――――哈哈哈，这孩子下次不会再忘记东西了吧#教育#,,,,教育,0,1,1,2022/10/7 20:08,iPhone 11,"['https://wx4.sinaimg.cn/large/005XwIDWgy1h6wz4dpywvj30n01ds16o.jpg', 'https://wx3.sinaimg.cn/large/005XwIDWgy1h6wz4fa06uj30n01dstnb.jpg', 'https://wx3.sinaimg.cn/large/005XwIDWgy1h6wz4c5s6nj30n01ds4d6.jpg']",,
4.82202E+15,M9eSCukGF,1295776050,娱乐圈bl,#教育##励志#内卷的诠释在于被卷之人如何感受L娱乐圈bl的微博视频,,,,"教育,励志",0,1,0,2022/10/7 19:43,微博视频号,,"http://f.video.weibocdn.com/u0/hm43bE1ggx07ZNOMP4Ss01041201bXT00E010.mp4?label=mp4_720p&template=1280x720.25.0&ori=0&ps=1BVp4ysnknHVZu&Expires=1665151471&ssig=Wwzelz4Wzd&KID=unistore,video",
4.82202E+15,M9eKduZ71,1033799302,冬天里的花开了,日本科技酱油#日本#海天酱油#教育##快手#@快手L日本高科技的快手视频,,,快手,"日本 ,教育 ,快手",0,0,0,2022/10/7 19:22,微博视频号,,http://www.kuaishou.com/rest/kd/partner/weibo/linkcard/video?p=3xqezbjephxzxti&a=3xdn4wuwy9i3e5k&f=3xaeigq5qc8fta6&kpn=NEBULA&subBiz=BROWSE_SLIDE_PHOTO&shareChannel=weibo&shareMethod=card&shareObjectId=5253167574076605561&shareResourceType=PHOTO_OTHER&shareToken=X905wnVX2iKV1l4,
4.82201E+15,M9eFzD1ZP,1074133411,王钢微言,今晚看看，如果觉得有道理，明儿践行，然后，坚持下去。#教育#L王钢微言的微博视频,,,,教育,0,0,0,2022/10/7 19:11,微博视频号,,"http://f.video.weibocdn.com/o0/ryH5MlzYlx07ZNMyx0CI01041200bqZj0E010.mp4?label=mp4_720p&template=720x1280.24.0&ori=0&ps=1BVp4ysnknHVZu&Expires=1665151471&ssig=caOolju%2Fom&KID=unistore,video",
4.822E+15,M9eoWsCqt,1988948421,南京科技馆,我馆《你好，科学！》系列科普视频上线啦！有趣、丰富的科学小知识，带你一起探索，快来关注小科，一起涨知识！c(￣ω￣(￣ω￣〃)f#科普##课程##教育##科技#L南京科技馆的微博视频,,,,"科普,课程,教育,科技",0,0,0,2022/10/7 18:30,微博视频号,,"http://f.video.weibocdn.com/o0/4t4Bz5y2lx07ZNocYm1q010412013NIh0E010.mp4?label=mp4_720p&template=720x1280.24.0&ori=0&ps=1BVp4ysnknHVZu&Expires=1665151471&ssig=1kIadvQ1DI&KID=unistore,video",
4.822E+15,M9emCyikR,5196224410,echo_万水千山走遍,很多年前有位家长问我：我陪孩子学习了，为啥效果不明显，孩子的学习没有明显进步。当时我是这样回答的：您要陪着孩子一起学习，参与他的学习。而不是孩子学习，您看您自己的书或者报纸。之前，我只是根据经验给的反馈。最近看到了关于parentengagement和parentinvolvement的理论，我才豁然开朗。多年前陪着孩子学习，参与孩子的学习是parentengagement。这意味着家长要融入孩子的学习中和孩子一起互动。举个例子，15minutescity这样的文章应该由家长和孩子两个独立平等的个体一起学习，然后一起探讨。孩子可以有自己的观点，家长也可以表达自己的观点，双方进行了深入的思想交流。而另一种参与模式是parentinvolvement，这指的是家长浅层地关注孩子的学习。举个例子，今天作业写完了吗？单词背了吗？在比如，您参加了家长会，了解了孩子的学习进度。Parentengagement和parentinvolvement的中文翻译基本没啥区别都是家长参与。但是，这是两种截然不同的参与方式。虽然研究文献表明parentengagement的学术成果收益远高于parentinvolvement，但是这并不意味着浅层的parentinvolvement不重要。两种参与和陪伴都有自己的闪光点，对于孩子来说都不可或缺。现在没有浅层的parentinvolvement的家长可以尝试参与孩子的学习规划设计，哪怕只是浅层次地参与到孩子的学习计划中。如果现在已经做到了parentinvolvement的家长，可以尝试进一步去深入参与孩子的学习，成为和孩子一起学习成长进步的陪伴者。这并不意味着家长要真的会很多知识（我们既有的socialeconomicbackground社会经济背景和educationbackground教育背景已经大致定型）。一个故事书，一篇散文，一篇报道，一段新闻都可以成为我们深入参与的孩子学习的途径，进而，让我们和孩子深入交流看法。最后，这不是在评价一个家长的行为。只是提出一种家长和孩子互动的可能性。不论是家长还是孩子，如果这段长文字能给您带来一点点思考，那就太美好了。2022.09.26转载注明出处#教育##亲子教育##萌娃养成记#,,,,"教育,亲子教育,萌娃养成记",0,0,0,2022/10/7 18:24,iPhone,,,
4.822E+15,M9eceCjKg,7703051176,状元未来,#教育##学习##老师#L状元未来的微博视频,,,,"教育,学习,老师",0,0,0,2022/10/7 17:58,微博视频号,,"http://fb.video.weibocdn.com/o8/ODrHsZFjlx07ZNHjFoZa01041200dZMr0E018.mp4?label=mp4_720p&template=720x1280.24.0&ori=0&ps=1BVp4ysnknHVZu&Expires=1665151471&ssig=WqSmtt3UWQ&KID=unistore,video",
4.822E+15,M9ebW1DbY,7703051176,状元未来,#教育##学习##老师#L状元未来的微博视频,,,,"教育,学习,老师",0,1,0,2022/10/7 17:57,微博视频号,,"http://fb.video.weibocdn.com/o8/Z6usDEyklx07ZNHzdxiw01041200ic1i0E018.mp4?label=mp4_720p&template=720x1280.24.0&ori=0&ps=1BVp4ysnknHVZu&Expires=1665151471&ssig=wRM8r3Sy8w&KID=unistore,video",
4.82199E+15,M9e5x9HqR,5716529303,远行客004,"一个朋友送我的图片，如何帮助不合群的学生/儿女,这的确是教育学很重要的话题，也是华人教育经常忽略的群体。你必须讨好父母老师，你必须合群，不然你的成长就会非常痛苦。无他，工具人社会无所谓爱和个人自由，不讨好又没利用价值的人，是社会的弃儿和仇人。#教育#",,,,教育,8,1,9,2022/10/7 17:42,Android客户端,['https://wx4.sinaimg.cn/large/006eRYpxgy1h6wv3acwlmj30dw0ibwgb.jpg'],,
4.82172E+15,M978acM4n,6193581962,窦昆老师,“一花开放不知春，百花开放春满园！#创业##教育#L窦昆老师的微博视频,,,,"创业,教育",0,1,0,2022/10/6 23:59,iPhone客户端,,"http://f.video.weibocdn.com/o0/tonxQjvolx07ZMvvEw1W01041200kSsc0E010.mp4?label=mp4_720p&template=720x1280.24.0&ori=0&ps=1BVp4ysnknHVZu&Expires=1665151481&ssig=8Jv2CUGfCv&KID=unistore,video",
4.82171E+15,M96Qxcn21,6776247819,WB趣世界,注：影片创作者只为分享自己发现的东西，本频道亦没有鼓动或鼓吹任何行为，请勿模仿，也要尊重别人~――――――――――?你的每日影片供应商?翻译.搞笑.潮流.挑战.趣闻.知识#丹麦##教育#LWB趣世界的微博视频,,,,"丹麦,教育",0,0,0,2022/10/6 23:16,微博视频号,,"http://f.video.weibocdn.com/u0/RkRVtmSdgx07ZMsw7eh201041200fNgV0E010.mp4?label=mp4_720p&template=720x720.24.0&ori=0&ps=1BVp4ysnknHVZu&Expires=1665151481&ssig=223bVZLC2J&KID=unistore,video",
4.8217E+15,M96rUFrq7,6665423864,为时不晚1314,又到了穿卫衣的季节啦高考#至臻高考##教育##教育培训机构##学习打卡#继续努力，加油学习！fighting,,武汉・至臻高考(武昌校区),,"至臻高考,教育,教育培训机构,学习打卡",0,0,1,2022/10/6 22:15,高考超话,"['https://wx1.sinaimg.cn/large/007h5rewgy1h6vxdntj6oj326z18gqbn.jpg', 'https://wx2.sinaimg.cn/large/007h5rewgy1h6vxdolz67j326z18gwmp.jpg', 'https://wx1.sinaimg.cn/large/007h5rewgy1h6vxdp13dij326z18g7bf.jpg', 'https://wx4.sinaimg.cn/large/007h5rewgy1h6vxdx58yqj30zk0k00tr.jpg']",,
4.8217E+15,M96rH69uG,5866338771,地产八卦男,国庆假期京楼二手房业务这块连续开单，今晚再签一份沉甸甸的合同，感谢大家信任。#北京买房#另外，西城学区幼升小、3-5年级转学、小升初的路径规划和咨询，也可以深度定制和保驾护航，打开你的视野，给你最优、最有性价比的升学方案。#教育#PS：未来最想做什么？打分+相亲，京楼有产阶级不Boring的一起手牵手，跟我走，咱不飞盘，咱正规的好好露营聊。,,,,"北京买房,教育",1,17,17,2022/10/6 22:14,HUAWEI Mate 40 Pro,"['https://wx1.sinaimg.cn/large/006p0yHhly1h6vx34blxgj335s2dc4qq.jpg', 'https://wx3.sinaimg.cn/large/006p0yHhly1h6vx35lzamj32nc1zi7wh.jpg', 'https://wx3.sinaimg.cn/large/006p0yHhly1h6vx39a6l2j31400u0qbj.jpg']",,
4.8217E+15,M96rzDmwV,1465107390,心阅语录娱扒,【贫穷与养育方式如何影响孩子的一生？】#教育#在黑暗中长大的孩子成人后如何去救赎自己？如果你是父母，或有一天成为父母，你又该如何影响孩子？这条TED演讲内容也许能给你一些启发。通过一项长达70年的科学跟踪研究，讲者探讨了一个人出身的贫富及父母的养育是如何影响孩子一生。L心阅语录娱扒的微博视频,,,,教育,0,0,2,2022/10/6 22:14,iPhone客户端,,"http://f.video.weibocdn.com/o0/SlUyzCCZlx07ZMoikPbO01041201pCw50E010.mp4?label=mp4_hd&template=640x360.25.0&ori=0&ps=1BVp4ysnknHVZu&Expires=1665151481&ssig=vATiAqNZ97&KID=unistore,video",
4.82169E+15,M96ius3MJ,1642407160,张多多的文艺老母亲,家庭教育#教育#英语#英语流利说#在兴趣面前，任何书都不难读。多多为什么爱读这本《美国国家地理》呢？因为小猫咪太可爱啦！?你家娃爱读英语绘本吗？L张多多的文艺老母亲的微博视频,,,,"教育,英语流利说",0,0,1,2022/10/6 21:52,微博视频号,,"http://f.video.weibocdn.com/o0/YmtHl1ZMlx07ZMmLFtvq01041200BFjd0E010.mp4?label=mp4_720p&template=720x1280.24.0&ori=0&ps=1BVp4ysnknHVZu&Expires=1665151481&ssig=DndRX5POOK&KID=unistore,video",
4.82168E+15,M961RuQGj,6670253892,催你一眠,#教育#热播剧《底线》高度还原“江歌案”！当真实事件有了画面……在教育孩子“与人为善，善待他人”的同时，我们不要忘了：这世界上有很多不堪的人。善待他人中的“他人”也是有一定标准的。童话中的大灰狼和恶毒的继母在现实世界里比比皆是。那我们该怎么做才能避免孩子保持善良的同时不受到伤害呢？孩子，请让你的善良带着锋芒。在父母的眼里孩子永远是天使，没有谁会忍心让自己的孩子过早地接触社会的阴暗面。残酷的战争、人与人之间利益纠葛、人性的不堪都应该回避在孩子那双童真的双眸之外。可是，一味地粉饰太平真的对孩子有益吗？难道真的等到孩子受伤害的一天才开始亡羊补牢？在我们教育孩子善良勇敢的同时，难道就没有想过听话的孩子很有可能会遭受到伤害？江歌案中我们可以看到，当江歌死后，将门反锁的刘鑫非但没有一丝丝的自责，反而极力地撇清关系。在记者的采访和警方的讯问刘鑫更是谎话连篇，破绽百出。当警方问及江歌生前打工的地点，刘鑫谎称酒吧，对死去的江歌泼尽脏水。刘鑫等于在江歌死后又杀了江歌一次。孩子，帮助别人要量力而行！帮助朋友，要力所能及。告诉孩子，力所不能及的事，千万不能去做，可以好好想一想能不能有更好的方法解决朋友的困境。当刘鑫将江歌推出门外时，江歌已经是弱势群体了。就算体重相等同等身高，论肌肉的张力，一个女人的力量也远远不及男人。这时候弱势的一方需要冷静，不要逞强，将事态和对方情绪稳定下来是第一位的。孩子，你要学会拒绝白眼狼。生活中有很多人，平时总是依附于人，到处寻求别人的帮助，却不允许自己的利益受到一点点伤害。如果一个人满脑子里只有索取和享受，从来不知道感恩，那只是一只喂不熟的白眼狼。玩要择伴，居要择邻。交的朋友一定要品行端正。如果遇到自私自利的人，孩子要懂得拒绝。刘鑫在未得到房东的许可下搬进江歌家中，除了几件衣服。她从来没有拿出过一分钱来支付房租。不但如此，就连洗发水沐浴露都是用江歌的，像这样自私自利的人，孩子要说不。不要和这样的人做朋友，因为在这种人的心中，世界是围绕着自己转的。孩子，请勇敢地保护自己。孩子一点一点长大，而父母一点一点老去。父母不可能时时刻刻陪在孩子左右，所以孩子要学会勇敢地保护自己。不是希望你勇敢，而是你必须勇敢。江歌案发生后，社会上对朋友的界定开始有了新的认识。大家都在扪心自问：我身边的朋友是怎样的？是否有着我所不知道的一面。这个苍白的世界也许没那么美好，不少人看到血淋淋的社会惨状开始裹足前行。江歌案唤醒的是朋友之间交往的界限和做事担当的责任，我们要勇敢地面对这一切。,,,,教育,0,0,0,2022/10/6 21:11,新版微博 weibo.com,['https://wx4.sinaimg.cn/large/007hpHKcly1h6vvk8l3iqj30ku0kut9b.jpg'],,
4.82167E+15,M95Egb4cp,6108292376,扒漫,【经典动画片】1987年上海美术电影制片厂动画片《有求必应》。讲了有一个土地庙，庙里有土地爷爷和土地奶奶，很灵验，于是人民送匾：有求必应。#教育##首席知识官#（via：鉴见）.O网页链接,,,,"教育,首席知识官",0,0,0,2022/10/6 20:13,二次元超话,,,
4.82167E+15,M95D187c2,6567039332,Steven建玮,好的教育一点也不简单，需要用心与爱心去教育。#教育#爱心#用心#不简单LSteven建玮的微博视频,,,,"教育 ,用心 ",0,0,0,2022/10/6 20:09,iPhone,,"http://f.video.weibocdn.com/o0/gpUgLUqklx07ZMfJzBio010412004vBr0E010.mp4?label=mp4_720p&template=720x1280.24.0&ori=0&ps=1BVp4ysnknHVZu&Expires=1665151481&ssig=%2FcO19WN1L3&KID=unistore,video",
