id,bid,user_id,用户昵称,微博正文,头条文章url,发布位置,艾特用户,话题,转发数,评论数,点赞数,发布时间,发布工具,微博图片url,微博视频url,retweet_id
4.81592E+15,M6G7uBAl1,2638854671,一只凌乱的猪,推荐一个好用的流量卡#你为省钱做过哪些努力##科技#615,,,,"你为省钱做过哪些努力,科技",0,0,0,2022/9/20 23:33,微博 weibo.com,['https://wx3.sinaimg.cn/large/9d49ba0fly1h6dhqwm3pxj20s217w3zx.jpg'],,
4.81591E+15,M6G0O4qOI,5578257175,清新Xp,#热门微博#日本宇航公司ispace计划11月使用猎鹰九号火箭将Hakuto-R着陆器送往月球，计划着陆在月球正面梦之湖区域，同时搭载阿联酋10千克重拉希德月球车。#科技##微博公开课#L清新Xp的微博视频,,,,"热门微博,科技,微博公开课",0,0,2,2022/9/20 23:16,微博视频号,,"http://f.video.weibocdn.com/u0/zKtnhRNugx07ZmWiJkly01041200cLka0E010.mp4?label=mp4_720p&template=720x1280.24.0&ori=0&ps=1BVp4ysnknHVZu&Expires=1665146128&ssig=0ILHAi1Y7I&KID=unistore,video",
4.81591E+15,M6FO7oXiz,1880163944,若希欧美升学指导,?09.20｜当晦暗散尽，终星河长明。?今日份「若希留学-早报快讯」来啦?看看今天有哪些最新的欧美亚留学、科技金融、海外工作和生活资讯?#国际新闻##国际##科技##美国##加拿大##分享##留学##留学生#,,,,"国际新闻,国际,科技,美国,加拿大,分享,留学,留学生",0,0,0,2022/9/20 22:45,,['https://wx2.sinaimg.cn/large/70110668gy1h6dgc2tl2wj20uk6deu0x.jpg'],,
4.81591E+15,M6FNRelCg,5714719345,Oneline科技,告诉大家一个不好的消息，红米K50真的要停产下架了，我去其他平台看了下，K50全系列都没货了，而且大部分已经下架了，估计以后想买也买不到了。说真的，K50真的是一代神机，天玑8100+三星2k120Hz直屏、5500mAh、67w直接封神，2199元更是不赚钱，我实在找不出可以吐槽的地方，这种神机现在下架真的太可惜了。不过也有网友说，小米这种性价比真的不行，太low了。但你可能不知道，在雷军心里，性价比早就是小米的代名词了，雷军在《小米创业思考》里说过：“创办小米，不想做一个坑人的人，而且我也非常不喜欢把稻草卖成金条的人。我们每天就像农民种地一样，一分耕耘一分收获。我们不做坑人的事情，哪怕这种人在市场上非常妥欢迎。”咱也不多说了，反正现在我看主流平台已经没货了，哪儿有货兄弟们可以说一声啊！对此你们怎么看？你们觉得这款手机咋样？#数码资讯##科技#,,,,"数码资讯,科技",1,56,73,2022/9/20 22:44,iPhone 13,"['https://wx4.sinaimg.cn/large/006eKnyFly1h6dgcjkeyyj30wi1ho47x.jpg', 'https://wx3.sinaimg.cn/large/006eKnyFly1h6dgcjuiuej30wi1i049k.jpg', 'https://wx4.sinaimg.cn/large/006eKnyFly1h6dgck4ywej30wi1sagof.jpg', 'https://wx2.sinaimg.cn/large/006eKnyFly1h6dgckiwz9j318g0tndgg.jpg']",,
4.8159E+15,M6FGlcGUy,5714719345,Oneline科技,比亚迪唐DMI到手200天，今天是用车最狠的一天！这位网友120块钱跑了160km，油电双双见底，对于这个数据，你们觉得还满足预期吗？据说这位网友是全程高速120km/h，但也有人说你这不是190km/h吗？因为这个是不计算混动的。多出来那30km是纯电跑出来的。你们对于这个花费以及里程有啥看法吗？对此你们怎么看？#汽车##科技#,,,,"汽车,科技",0,2,6,2022/9/20 22:26,iPhone 13,"['https://wx4.sinaimg.cn/large/006eKnyFly1h6dftamxj3j30u01h0gn4.jpg', 'https://wx1.sinaimg.cn/large/006eKnyFly1h6dftaclgwj30u01ixn2r.jpg', 'https://wx2.sinaimg.cn/large/006eKnyFly1h6dftaylyqj30u01h2wkm.jpg']",,
4.8159E+15,M6FCjfHLB,5714719345,Oneline科技,后悔买iPhone14Pro了！前天刚到手，加价200买的，本以为能超出我的预期，结果瞬间凉凉，来说说使用感受。1.灵动岛很难用，现在很多应用都不支持灵动岛，这功能就像个摆设，而且非常突兀。2.48MP拍照是牛，比我之前用的华为好很多，唯一缺点就是还有鬼影。3.信号差，我坐在同一个位置打游戏，华为有信号，苹果卡到爆炸，而且在家打电话还没信号…4.充电也太慢了，我华为都几十瓦快充，苹果还是20w，而且充电时手机非常烫，必须要用散热器才行。没啥办法，现在我要原价出了，真的用不惯，尤其是打开微信，光是接收信息就要几十秒…我还不如买华为。对此你们怎么看？#数码资讯##科技#,,,,"数码资讯,科技",20,567,1513,2022/9/20 22:16,iPhone 13,"['https://wx1.sinaimg.cn/large/006eKnyFly1h6dfixs1aaj30zk1behdt.jpg', 'https://wx3.sinaimg.cn/large/006eKnyFly1h6dfiwumw8j30zk0qox0h.jpg', 'https://wx3.sinaimg.cn/large/006eKnyFly1h6dfiympqaj30zk1benln.jpg']",,
4.8159E+15,M6Fvqc9ET,5714719345,Oneline科技,你觉得最伟大的中国企业是哪家？1.华为2.比亚迪3.小米4.腾讯5.阿里巴巴6.贵州茅台7.字节跳动8.美团9.百度10.宁德时代个人觉得华为是最伟大的中国企业，虽说现在手机价格高到离谱以外，在技术研发、芯片能力以及通信技术上，华为都是世界顶级的，而且他确实是以一己之力抗下了芯片产业中的所有压力，这样的企业值得让人尊敬。对此你们怎么看？你们觉得最伟大的中国企业是哪家？#科技##数码资讯#,,,,"科技,数码资讯",1,6,6,2022/9/20 21:59,iPhone 13,['https://wx3.sinaimg.cn/large/006eKnyFly1h6df1au77ij30go0ciq3s.jpg'],,
4.81589E+15,M6FsOCkOd,1286293690,孙永杰,乌军在被夺回的伊久姆和巴拉克利亚等地进行排雷和排爆！#俄乌局势最新进展##军事##科技##排雷##排爆##伊久姆##巴拉克利亚#L孙永杰的微博视频,,,,"俄乌局势最新进展,军事,科技,排雷,排爆,伊久姆,巴拉克利亚",1,0,2,2022/9/20 21:52,微博视频号,,"http://f.video.weibocdn.com/o0/GWGyIBQzlx07ZmQypNfa01041200GLWG0E010.mp4?label=mp4_720p&template=1280x720.25.0&ori=0&ps=1BVp4ysnknHVZu&Expires=1665146128&ssig=1Hn6ZPQbll&KID=unistore,video",
4.81589E+15,M6Frq4Vaj,5714719345,Oneline科技,比亚迪：我们超过特斯拉了！网友：比亚迪你就装吧！华为：我们超过苹果了！网友：华为没5G，千万不要买！好像咱们国产越好，有些国人就越看不惯，这不C919马上就可以投入使用了，结果又有一批人来吐槽。这位网友更是说，希望以后买机票的时候标明，想坐就去坐，不想坐的还得有备选，毕竟命是自己的。搞得就好像我们国产飞机就一定会有事一样，也不知道这兄弟坐过飞机没？现在飞机型号都会写清楚，你坐不坐没人强迫你，就为了带节奏说这种错话有意思吗？那些专门喷国产的人真是太可恶了！令人气愤！对此你们怎么看？#科技##数码资讯#,,,,"科技,数码资讯",0,4,7,2022/9/20 21:49,iPhone 13,['https://wx2.sinaimg.cn/large/006eKnyFly1h6der150g7j30ro0b5tet.jpg'],,
4.81589E+15,M6FoMmDeB,7578765156,辰星科技迷,vivoXFold+的配置规格：内屏为2K/120HzLTPO大屏，内外均支持120Hz刷新率，体验上不用担心会有割裂感，还配备了双超声波屏下指纹。补齐了上代火龙芯片的短板，搭载了骁龙8+处理器，性能/能效表现有较大的升级。背部依然延续了上代天圆地方的设计，影像系统有不错的堆料：5000万大底主摄+4800万超广角+1200万2X人像+800万5X潜望式长焦。电池容量4730mAh，支持80W有线+50W无线。新增了红色素皮后盖，新配色可能会命名为华夏红，估计是为了迎接国庆，质感还是不错的#科技#,,,,科技,0,0,0,2022/9/20 21:42,互联网科技iPhone 12,"['https://wx1.sinaimg.cn/large/008gTJ1Gly1h6dejzanjnj30u00lu0ti.jpg', 'https://wx4.sinaimg.cn/large/008gTJ1Gly1h6dejzpx0rj30u00mudii.jpg']",,
4.81555E+15,M6wqEdqCh,1807019022,名之成,【从0到1的突破国产大飞机C919有望飞向全球：只要1个条件】取证成功不仅意味着C919可以飞国内航线，还有望执飞国际航线，只需要一个条件――有业内人士表示，理论上只要对方国家认可我国民航局的认证，C919就可以飞往以及出口至相关国家。（转摘）#大飞机##国产大飞机c919首飞##科技#O网页链接,,,,"大飞机,国产大飞机c919首飞,科技",0,0,0,2022/9/19 22:52,,['https://wx3.sinaimg.cn/large/6bb4ec0egy1h6cayosl31j20go08rwen.jpg'],,
4.81554E+15,M6woo9ERY,5714719345,Oneline科技,黄牛：PDD，你断我财路！夕夕：这tm不是来捣乱的吗？黄牛恐怕想鲨了PDD的心都有了，发财的梦就此破灭！这个价格真的很香，就是不知道有多少备货，便宜1000可还行？我之前也抢过，耳机倒还好，手机是真的抢不到，但我身边却有人能抢到，有时候点进去了，结果网络瞬间卡顿，然后就销售一空了，也不知道是套路还是真的很抢手。你们都抢到了吗？当初你们怎么看？#数码资讯##科技#,,,,"数码资讯,科技",0,2,2,2022/9/19 22:47,iPhone 13,['https://wx1.sinaimg.cn/large/006eKnyFly1h6casvvlcsj30tt1jmn73.jpg'],,
4.81554E+15,M6wmBBusP,7478483114,z340216339,汲取自然灵感，臻储食材新鲜本味！最浓不过人间情，最美不过人间味。#海信真空冰箱#能鲜养活鱼?，能鲜养豆苗?，能生腌海鲜???……简直无所不能，和你一起探鲜金秋食宴，共享每个团圆时刻?#真空・才是真保鲜##保鲜##海信真空冰箱##科技##家居美学#Lz340216339的微博视频,,,,"海信真空冰箱,真空・才是真保鲜,保鲜,科技,家居美学",1,0,5,2022/9/19 22:42,iPhone客户端,,"http://f.video.weibocdn.com/o0/YQncwlftlx07Zlj68WoU010412009Y300E010.mp4?label=mp4_720p&template=720x1166.24.0&ori=0&ps=1BVp4ysnknHVZu&Expires=1665146139&ssig=mFyDbe7WJ%2B&KID=unistore,video",
4.81554E+15,M6wju76k2,5714719345,Oneline科技,咽不下这口气，中国人要有自己的CPU芯片！中科院计算技术研究所总工程师、龙芯总设计师胡伟武握紧拳头，眼眶湿润的说出了这句话！知道我们为什么还要使用英特尔吗？你要了人家技术，就会丧失你的研发能力，如果中断了自主研发过程，你就只能跟着它，它给你什么，你要什么，很受牵制。我们没有办法不用，《瓦森纳协定》的签订，对包括计算机在内的中国尖端科技实施全面封锁。我国计算机系统运算和控制核心的CPU芯片全部依赖进口。胡伟武：“有半年时间茶不思、饭不想，后来突然想到这句话‘打得一拳开，免得百拳来’。”面对这样的局势，胡伟武带领团队开始了“反击”。2019年底，龙芯开始研发自己的指令系统“龙架构”。如今，基于“龙架构”所创建的龙芯信息生态体系已经初具规模，在国内的应用越来越广。在谈到人们对龙芯的评价时，胡伟武说，“希望人们买龙芯不是因为支持自主，而是基于它性价比的考虑。另外，人们提到龙芯、提到这帮人时，觉得他们还是做实事的，说到能做到，就行了。”其实国内很多厂商都提前预测到了这个结果，雷军早在《小米创业思考》中说过，什么是科技公司？就是以技术创新为先导，以技术进步为根本驱动，以技术支撑产品和交付以赢得用户的公司。对科技公司而言，技术之所以如此重要，是因为深人地理解、掌握技术，不仅是当下出色性能、优秀体验的核心基础，更是持续优化性能与体验、交付杰出产品及服务，以区持续洞见未来技术、产业发展方向并保持领先的关键保障。其实不管是什么行业，什么公司，技术研发能力是至关重要的，否则只靠合作，总有一天会被他人超越，自己还是不能进步。相信未来我们一定能研制出属于自己的NPU芯片，突破封锁！对此你们怎么看？#科技##数码资讯#,,,,"科技,数码资讯",1,1,3,2022/9/19 22:35,iPhone 13,"['https://wx3.sinaimg.cn/large/006eKnyFly1h6cag9jpd8j30zk0jt11k.jpg', 'https://wx1.sinaimg.cn/large/006eKnyFly1h6cag9e99uj318f0tmjsk.jpg', 'https://wx2.sinaimg.cn/large/006eKnyFly1h6cag9zj31j317c0oiaxd.jpg']",,
4.81554E+15,M6w9QlhQe,5714719345,Oneline科技,华为Mate50都出了，但我朋友却换了个华为Mate40Pro？价格也不算便宜，这价格我感觉还不如买台iPhone14Pro。后来我去问他为啥买台老机子，他说我不会用骁龙8+的，有麒麟芯片才是真正的华为手机。要知道这哥们开的可是特斯拉Model3，家里条件非常殷实，要我说他就是脑子瓦特了，要我早换iPhone14Pro了。对此你们怎么看？#数码资讯##科技#,,,,"数码资讯,科技",0,19,27,2022/9/19 22:11,iPhone 13,['https://wx4.sinaimg.cn/large/006eKnyFly1h6c9rlrqzaj30u013onc2.jpg'],,
4.81553E+15,M6w6Kg1zI,1286293690,孙永杰,俄军攻击乌克兰第二大核电站―皮夫登努克兰斯克核电站，所幸导弹在仅离核反应堆300米的地方爆炸，只是损毁周边一些建筑，但这种攻击行为实在太危险了！#俄乌局势最新进展##军事##科技##核电站##皮夫登努克兰斯克核电站#L孙永杰的微博视频,,,,"俄乌局势最新进展,军事,科技,核电站,皮夫登努克兰斯克核电站",0,0,3,2022/9/19 22:03,微博视频号,,"http://f.video.weibocdn.com/o0/UsWd2SESlx07ZlgpCR2E010412002LGC0E010.mp4?label=mp4_720p&template=1280x720.25.0&ori=0&ps=1BVp4ysnknHVZu&Expires=1665146139&ssig=%2FEBmBUjejH&KID=unistore,video",
4.81553E+15,M6w484OwM,5714719345,Oneline科技,卧槽？400万台华为Mate50系列卖光了！虽说距离华为Mate30系列的700万台还有一定差距，但对于目前的华为而言，能在开售当天将备货的400万台销售一空，华为Mate50系列已经是个神话了，遥遥领先所有厂商，华为号召力真不是盖的。要知道这手机可是4G，骁龙8+，并没有华为最得心应手的麒麟芯片。试着想想，如果是5G版麒麟Soc华为Mate50系列，开售当天全网+线下渠道的所有订单总和超1000万绝对不是问题！只可惜，华为不再是当年的那个华为。对此你们怎么看？#数码资讯##科技#,,,,"数码资讯,科技",0,7,6,2022/9/19 21:57,iPhone 13,['https://wx4.sinaimg.cn/large/006eKnyFly1h6c9cxox5tj30ls0jfjuk.jpg'],,
4.81553E+15,M6vZQFdEp,1807019022,名之成,【视频】金灿荣比较中国和美国的科技优势。#中国##美国##科技#O金灿荣：同样是研究稀土，我们提取17种矿物质，美国1个,,,,"中国,美国,科技",0,0,0,2022/9/19 21:46,,,,
4.81553E+15,M6vVRB8JA,5714719345,Oneline科技,库克赢了，黄牛这次真的亏大了！iPhone14系列国航报价把黄牛整惨了：iPhone14顶配暴降900！iPhone14Pro涨价400！iPhone14ProMax涨价900！这对比前两天涨价3000来看，简直就是小巫见大巫，估计黄牛都哭惨了，把这个当做赚钱生意可真不值当的，还不够亏本！黄牛们下次别守着iPhone了，看看友商华为吧…对此你们怎么看？#数码资讯##科技#,,,,"数码资讯,科技",0,3,7,2022/9/19 21:36,iPhone 13,['https://wx1.sinaimg.cn/large/006eKnyFly1h6c8rrk2w6j316i0j3ahq.jpg'],,
4.81553E+15,M6vVAdv2B,1286293690,孙永杰,放毒时间，三星GalaxyS22Ultra和华为Mate50Pro拍照对比！哪个是华为？哪个又是三星？#科技##智能手机#手机拍照##三星galaxys22ultra##华为mate50pro#L孙永杰的微博视频,,,,"科技,智能手机",2,2,1,2022/9/19 21:36,微博视频号,,"http://f.video.weibocdn.com/o0/P8QNNZ9Xlx07ZlewrNnW01041200TXjh0E010.mp4?label=mp4_720p&template=1280x720.25.0&ori=0&ps=1BVp4ysnknHVZu&Expires=1665146139&ssig=R%2BlBddvZBo&KID=unistore,video",
4.81519E+15,M6nfHxJ9B,5120025748,股市人生牛股多多,当前在车联网技术、产业、供应链发展的初期，由于系统的不完善，产生了一些意想不到的事故和故障，因此更要呼吁“发展要安全”。在分析近年来国内外发生的多起涉及到辅助驾驶的恶通事故的原因时，俞春俊指出，一是厂家夸大宣传，把辅助驾驶说成了自动驾驶误导车主；二是车辆感知决策算法确实存在漏洞，在对已发生的几起开启自动驾驶功能的车辆事故分析表明，超过80公里时速的高速行驶状态下，视频、雷达对于静止或低速车辆的识别能力显著减弱，有的感知已被当作“干扰杂波”给过滤掉了，事故直接表现为，车辆无任何紧急制动或要求接管的指令，径直撞向静止或低速行驶的车辆。“这些事故也从一个方面反映了自动驾驶技术的现状，那就是安全性有待提高。”俞春俊表示。由此，俞春俊指出，自动驾驶与车联网的发展还存在一定的挑战。#虚拟偶像为什么越来越火##科技##汽车#,,,,"虚拟偶像为什么越来越火,科技,汽车",0,0,1,2022/9/18 23:31,Redmi K40 Pro,['https://wx1.sinaimg.cn/large/005Av6Asly1h6b6fvxl6jj30z80h4dgc.jpg'],,
4.81519E+15,M6n4C1NSV,5660356332,科技知识分享,电脑DW网站内容制作使用方法#超级话题互动##科技##互联网科技##电脑#L科技知识分享的微博视频,,北京・天安门广场,,"超级话题互动,科技,互联网科技,电脑",0,0,0,2022/9/18 23:03,微博视频号,,"http://f.video.weibocdn.com/o0/RnQgSIRUlx07ZjJG4StW01041200WN050E010.mp4?label=mp4_720p&template=1280x720.25.0&ori=0&ps=1BVp4ysnknHVZu&Expires=1665146153&ssig=xe%2BUqquSki&KID=unistore,video",
4.81518E+15,M6mOBpVy1,5233245862,赵小溪1976,"来一起感受一下75U7G-PRO带来的视听盛宴U7G-PRO系列,带有独立的高中低音箱单元用声音把整个人拉入现场的感觉,如果有时间一定要去实体店体验一下,这款电视会惊艳到你的。#海信电视##科技##海信ULED电视#L赵小溪1976的微博视频",,,,"海信电视,科技,海信ULED电视",0,0,0,2022/9/18 22:24,iPhone客户端,,"http://f.video.weibocdn.com/o0/g5FI9Turlx07ZjGXsuDu01041200JTju0E010.mp4?label=mp4_720p&template=1280x720.25.0&ori=0&ps=1BVp4ysnknHVZu&Expires=1665146153&ssig=%2B3eEy1ulvZ&KID=unistore,video",
4.81517E+15,M6mKKkAjd,5714719345,Oneline科技,太卷了！别克君威优惠5.2w，这不是白给吗？本以为丰田凯美瑞能优惠2w已经冬顶天了，结果别克君威直接优惠5.2w，这不是白给吗？而且别管是动力、配置还是安全性上，别克君威都比凯美瑞好太多，但销量却是天差地别，难道现在人买车就看油耗和保值率吗？有网友说凯美瑞不是混动，纯油的，油耗5.6，是个人都不会相信，来我修理厂，带你去看看凯美瑞油耗，真的吹牛吹破天了。对此你们怎么看？#汽车##科技#,,,,"汽车,科技",0,4,2,2022/9/18 22:14,iPhone 13,['https://wx4.sinaimg.cn/large/006eKnyFly1h6b1f2qe0kj30u01h0kf7.jpg'],,
4.81517E+15,M6mKK7n9j,5714719345,Oneline科技,华为：我们有物理可变光圈！网友：这叫什么创新？小米：我们有1亿像素和性价比！网友：这tm叫创新？苹果：我们有灵动岛！网友：这才叫创新！给我买爆它！为什么苹果就变了下UI，网友和消费者集体狂欢，线下实体店又排起了长队？这难道就叫做遥遥领先吗？我记得雷军曾在《小米创业思考》中说过：“极致的产品有两个条件：一是产品要惊艳，设计要惊艳，成本也要惊艳；二是超出了用户预期，真的能让用户尖叫。试图用一款产品来解决很多需求，除了产品开发、推广难度大，未必能够凭借功能的数量优势赢得竞争优势，有时候甚至会误导开发者。”其实像雷军这样的企业家早就看透了本质，但为什么苹果还执迷不悟，我们消费者还在不停支持苹果？这着实令人费解！对此你们怎么看？#数码资讯##科技#,,,,"数码资讯,科技",1,17,46,2022/9/18 22:14,iPhone 13,['https://wx3.sinaimg.cn/large/006eKnyFly1h6b48vabxvj30zk2a5qv5.jpg'],,
4.81517E+15,M6mDzoj4p,5714719345,Oneline科技,看看腾讯是如何吊打阿里的？这是全面压制啊！不过也有网友觉得阿里没有游戏这一项在我心里就全胜了，王者耽误了多少人。看了这张图以后，感觉阿里更有社会责任感。对此你们怎么看？你们用阿里系多，还是腾讯系多？对此你们怎么看？#科技#,,,,科技,0,0,5,2022/9/18 21:57,iPhone 13,['https://wx3.sinaimg.cn/large/006eKnyFly1h6b0h978s0j30og2n7aez.jpg'],,
4.81517E+15,M6mD8pn4R,5714719345,Oneline科技,iPhone14Pro用三天了，说下大家比较关心的几个重点问题。1.灵动岛，实际观感还不错，强光下也不容易看到挖孔，唯一缺点就是现在很多软件还没彻底适配，只有系统应用支持灵动岛，动画还是很流畅的，用起来有点不适应，不过有开发者弄了电子宠物在灵动岛上，还挺好玩。2.iPhone14Pro刷新率锁在了80Hz，虽说使用起来没啥大影响，但还是建议后期给恢复到120Hz。3.48MPProRAW主摄直出图，照片真的强好多，夜景噪点很少，画面也很纯净，即使2x也不虚，唯一缺点就是鬼影依然存在。运动模式拍视频真的很稳，即使你跑很快也不是特别抖。对此你们怎么看？你喜欢灵动岛设计吗？#数码资讯##科技#,,,,"数码资讯,科技",2,41,76,2022/9/18 21:56,iPhone 13,"['https://wx1.sinaimg.cn/large/006eKnyFly1h6b3pca9nsj30zk1beas6.jpg', 'https://wx3.sinaimg.cn/large/006eKnyFly1h6b3pd3ar6j30zk1bex43.jpg', 'https://wx3.sinaimg.cn/large/006eKnyFly1h6b3pdbzdjj30zg1batce.jpg']",,
4.81516E+15,M6mucnEau,5714719345,Oneline科技,郭台铭大放厥词，我们是在给大陆饭吃？郭台铭曾在内部会议说：“我在帮中国大陆创造就业机会，他们需要我们，大于我们需要他，我是在给大陆饭吃。”话糙理不糙，但这么说出口未免有些过于自大，如果没有内地高价值、低报酬的劳动力和无限制的加班，富士康能有今天吗？恐怕早就跑到东南亚了吧？而且工人付出时间与劳力换取工资，为啥说你养活他们？看看印度和越南，又懒又不服从管教，我们就能做到上24休息24。对此你们怎么看？#科技#,,,,科技,0,1,0,2022/9/18 21:34,iPhone 13,['https://wx3.sinaimg.cn/large/006eKnyFly1h6b09j8wyvj30u013qwh8.jpg'],,
4.81516E+15,M6mt7AGr4,5714719345,Oneline科技,美国这就是自食其果！杀敌一千自损八百。近日，波士顿咨询公司预测，如果阿美继续加码对中国芯片出口的限制措施，美芯片行业将要失去18%的全球市场份额，以及37%的收入，并减少1.5万~4万个高技能工作岗位。虽说这事儿对于国内芯片厂商而言是个不好的消息，但是对于大部分芯片厂商而言，影响并不是很大，前段时间中国工信部就已经公布，14纳米先进工艺规模量产，90纳米光刻机、5纳米刻蚀机、12英寸大硅片、国产CPU、5G芯片等实现突破，这意味着28nm芯片技术中国已经成熟，对电动车和机器人行业来说，芯片足够供应了。世界警察终究会受到惩罚！对此你们怎么看？#科技##数码资讯#,,,,"科技,数码资讯",0,0,0,2022/9/18 21:31,iPhone 13,"['https://wx4.sinaimg.cn/large/006eKnyFly1h6b2zpep3qj30cm08g75n.jpg', 'https://wx2.sinaimg.cn/large/006eKnyFly1h6b2zpknymj30u00kj42e.jpg', 'https://wx3.sinaimg.cn/large/006eKnyFly1h6b2zpp78fj30go0b4dgm.jpg']",,
4.81516E+15,M6mrBonmg,1365180127,管理界刘春华,厉害了！华为打响了“科技阻击战”，中科院也毫不示弱。#华为##中科院##科技#华为L管理界刘春华的微博视频,,青岛,,"华为,中科院,科技",0,0,5,2022/9/18 21:27,华为超话,,"http://f.video.weibocdn.com/o0/DOE1C4bYlx07ZjD1KwdO01041200xBWc0E010.mp4?label=mp4_720p&template=720x1332.24.0&ori=0&ps=1BVp4ysnknHVZu&Expires=1665146153&ssig=PHHAAEfDWk&KID=unistore,video",
4.81482E+15,M6dpy8eGT,5714719345,Oneline科技,余承东诚不欺我！华为超级中转站真的好用！网友刚把手头的华为Mate50升级到鸿蒙3.0，迫不及待的使用了超级中转站，可以说这项功能完美解决了图片复制粘贴的致命问题，你可以在本地终端、跨设备终端，随便复制文字和复制图片，还可以直接复制视频。要知道之前是不能在剪贴板上互相流转的，只能拖到手机上，这个功能出现直接打通了华为所有设备的联通性，也类似于苹果的AirDrop，购买华为Mate50系列的朋友们可以升级鸿蒙3.0试试看！#数码资讯##科技#,,,,"数码资讯,科技",0,17,74,2022/9/17 22:27,iPhone 13,"['https://wx2.sinaimg.cn/large/006eKnyFly1h69yykbkypg30m70chx6v.jpg', 'https://wx3.sinaimg.cn/large/006eKnyFly1h69yyiwdeqg30m80goe82.jpg']",,
4.81481E+15,M6dp6ktaW,5623612787,Rani-7,【中国与阿联酋签署协议，未来将执行联合月球任务】??[小红花]今天，中国国家航天局（CNSA)和阿联酋穆罕默德・本・拉希德太空中心（MBRSC）签署了谅解备忘录。这将是两国之间的首次太空合作。阿中两国融为一体，在伟大的征程中突破创新边界，在先进科技引领下探索太空，播种希望，为全人类造福，创造更美好未来?祖国反黑站#科技#,,,,科技,2,0,7,2022/9/17 22:26,祖国反黑站超话,['https://wx4.sinaimg.cn/large/0068A6A3gy1h69yqrqwsoj30rs0hmmz1.jpg'],,
4.81481E+15,M6dmrqfhC,1286293690,孙永杰,乌克兰的天是明朗的天，乌克兰人民好喜欢！#俄乌局势最新进展##军事##科技#L孙永杰的微博视频,,,,"俄乌局势最新进展,军事,科技",0,0,0,2022/9/17 22:20,微博视频号,,"http://f.video.weibocdn.com/o0/bFyOOoXllx07Zi5LmMMw010412006B1n0E010.mp4?label=mp4_720p&template=1280x720.25.0&ori=0&ps=1BVp4ysnknHVZu&Expires=1665146165&ssig=0D4GhK3QX2&KID=unistore,video",
