id,bid,user_id,用户昵称,微博正文,头条文章url,发布位置,艾特用户,话题,转发数,评论数,点赞数,发布时间,发布工具,微博图片url,微博视频url,retweet_id
4.81121E+15,M4HGgrcLq,5713877791,招财女侠,中国35项被卡脖子的关键技术清单，包括芯片，光刻机、操作系统、光刻胶、激光雷达、高端电容电阻等等，2020年，中国科学院列出了35项“卡脖子”技术清单，作为科研任务清单。这些年，欧美的频频封锁，深刻警醒我们，关键核心技术是国之重器，拿不来、买不来、讨不来，只能看自己造的来。科技是第一生产力，必须把科技的命脉牢牢掌握在自己手中，不断提升我国发展的独立性、自主性和安全性！！！#财经##芯片##科技##股票#,,,,"财经,芯片,科技,股票",3,1,4,2022/9/7 23:50,,['https://wx4.sinaimg.cn/large/006eGQDdgy1h5yh7evjr9j30e90qmtb8.jpg'],,
4.81121E+15,M4HE6xu99,6858772058,财经女侠岚岚,iPhone14备货3400万部，绝不给黄牛可趁之机。果然，针对国内的各种不正当行为，还是苹果最有办法。据悉，iPhone14已生产超过3400万台，9000万的年底订单已经完成了三分之一。这也就意味着，大多数消费者都能够通过正规渠道买到新机，这对于那些黄牛商家来说，想要借此赚钱可能就不太现实了。其实，不论是之前的流氓软件，保护用户的隐私问题，还是如今的充足供应量，苹果对于国内的这些不恰当行为还是有一套的。iphone14也将马上发售，3400万的供货量，全系上涨的价格，恐将再次引发一股抢购热潮。#iphone14##科技#,,,,"iphone14,科技",0,0,2,2022/9/7 23:45,,['https://wx4.sinaimg.cn/large/007uaHVMgy1h5yh1mnhzdj30dx0agjs7.jpg'],,
4.81121E+15,M4HzFuE1Y,1286293690,孙永杰,“东方-2022”（Vostok）军事演习中，俄军“堡垒”海岸导弹系统发射中！#俄乌局势最新进展##军事##科技##东方-2022军演##堡垒海岸导弹系统#L孙永杰的微博视频,,,,"俄乌局势最新进展,军事,科技,东方-2022军演,堡垒海岸导弹系统",0,0,2,2022/9/7 23:34,微博视频号,,"http://f.video.weibocdn.com/o0/loDF5llMlx07Z2dXRkda01041200ud6x0E010.mp4?label=mp4_720p&template=1280x720.25.0&ori=0&ps=1BVp4ysnknHVZu&Expires=1665146282&ssig=3Rgvd8TdIk&KID=unistore,video",
4.81121E+15,M4Hzy8FZ8,5499828210,楚雪琪雨,#那年今日##科学##科技#来源：SCI-HUB科学技术史上的今天-9月7日1514年9月7日，在匈牙利降落了一块陨石，后来它被当作“神的礼物”搬到了教堂，神父们为了怕它又飞回去，就用铁链把陨石锁在了墙上。1908年9月7日，美国著名医师德巴基出生。1963年，德巴基首次将机械装置植入胸腔以辅助心脉跳动获得成功，患者于移植后存活了四天。1956年9月7日，中国核物理学家王n昌等在宇宙线的研究中发现了一种新的“基本粒子”――中性重介子。1988年9月7日，中国自行研制的第一颗极地轨道气象卫星“风云-1号”发射成功，标志着我国航天技术达到新水平。它提高了我国天气预报的时效性、准确性以及监察灾害性天气的能力。,,,,"科学,科技",0,0,0,2022/9/7 23:34,Note 9 Pro 一亿像素,,,
4.8112E+15,M4HpGEvWI,5192274176,科技讲解,#科技#其实这个时候，我还是建议大家相信品牌的作用。事实上从品牌的基本原理上来说，品牌存在的意义就是对一个产品所有的性能、质量、品位等所有内外部特征做背书的。有这个品牌在，我就不用费脑子了，看见品牌宣传品就可以放心。这是品牌给用户创造价值的核心意义,,,,科技,0,1,0,2022/9/7 23:10,微博影响力联盟超话,,,
4.8112E+15,M4HlWpeBw,5538832144,可爱v喵酱,#数字人民币##科技##金融#数字人民币新版本的元管家服务，应该就不怕突然倒闭的健身馆或者教育机构了吧，毕竟没花完的钱可以有智能合约保障，退款应该有保障，反正我目前是这么理解的。,,,,"数字人民币,科技,金融",0,2,2,2022/9/7 23:00,vivo X30 Pro专业影像,['https://wx2.sinaimg.cn/large/0062Qngkly1h5yfojpv9kj30u01s075a.jpg'],,
4.8112E+15,M4HfSyiG5,7578765156,辰星科技迷,这两款手机除了屏幕大小略有不同以外，整体外观保持一致。均承袭了Mate家族标志性的对称基因，融入巴黎饰订设计理念，整体辨识度极高。屏幕方面，Mate50选用一块6.7英寸OLED显示屏，支持90Hz刷新率。而Mate50Pro则是选用了一块6.74英寸OLED显示屏，支持120Hz刷新率，并支持3D人脸支付。如果想要追求大屏以及更加舒适的观感，可选择Pro版本，反之无特别要求的可直接选购Mate50。#互联网科技##科技#,,,,"互联网科技,科技",0,0,1,2022/9/7 22:45,互联网科技iPhone 12,['https://wx4.sinaimg.cn/large/008gTJ1Gly1h5yfbpndk6j30u00gemz3.jpg'],,
4.81119E+15,M4H970Qc2,5233245862,赵小溪1976,欣赏艺术，享受品味人生｜海信激光电视以温润木色为基调的极简风格，优雅有格调。白色悬浮背景墙嵌入海信激光电视，增加了整体设计的层次感，也带来更加生动有趣的视觉体验。银色和普鲁士蓝相间的主机闪耀着金属独有的光泽，与木色地台相得益彰，更显高级。#海信激光电视##家居装修##科技#L赵小溪1976的微博视频,,,,"海信激光电视,家居装修,科技",0,0,0,2022/9/7 22:29,iPhone客户端,,"http://f.video.weibocdn.com/o0/sa64FtLblx07Z29tdgYM010412002fME0E010.mp4?label=mp4_720p&template=720x1280.24.0&ori=0&ps=1BVp4ysnknHVZu&Expires=1665146282&ssig=0Szd2cuL3x&KID=unistore,video",
4.81119E+15,M4H8h2Fj7,5714719345,Oneline科技,今天去线下体验了华为Mate50系列，来说说真实感受。如果你不喜欢直屏，预算ok的话，建议直接购入Mate50Pro，这质感真的没话说。就说发布会上的昆仑玻璃，实际上手的感觉还是相当不错的，触感很细腻，不怎么打滑，有镜面效果，但容易沾染指纹，重量很轻，比我手头的Mate40轻不少。后置镜头模组…说真的，差的不是一点半点，反正不符合我自己的审美，在意后背板美观度的不建议购买。不过这画质确实蛮厉害的啊，尤其是那个可变光圈，真的惊艳到我了。8G运存，不咋杀后台。但要说谁最好看，那绝对是售价12999的华为Mate50RS保时捷版本。总的来说，值得购买，有没有5G影响不大，甚至说根本就没有影响，放心买就行了。对此你们怎么看？#数码资讯##科技#,,,,"数码资讯,科技",0,19,43,2022/9/7 22:27,iPhone 13,"['https://wx4.sinaimg.cn/large/006eKnyFly1h5yes93y11j30wi0u5gsv.jpg', 'https://wx3.sinaimg.cn/large/006eKnyFly1h5yes8uua0j30u00k0q3h.jpg', 'https://wx1.sinaimg.cn/large/006eKnyFly1h5yes99mg8j30u00k0q6b.jpg', 'https://wx4.sinaimg.cn/large/006eKnyFly1h5yes9eahkj30u00k0juz.jpg']",,
4.81119E+15,M4H7t1WMg,7578014687,浩哥新商业,雷军自不量力？当很多人以为首款小米汽车的定价会是10-15万元时，首款小米汽车就该定价30万？#财经##科技##汽车#L大脑宇宙学派的微博视频,,,,"财经,科技,汽车",0,0,0,2022/9/7 22:25,微博视频号,,"http://f.video.weibocdn.com/o0/HSuQjNnilx07Z29b98VG01041201yRtE0E010.mp4?label=mp4_720p&template=720x1280.24.0&ori=0&ps=1BVp4ysnknHVZu&Expires=1665146282&ssig=KZCgx7Z2Kq&KID=unistore,video",
4.81084E+15,M4xXz6eMB,5379161953,北京创行智能团队,"#科技##干细胞#我们对“衰老”这个词不陌生，但是人们常常把衰老片面的解读为：岁月带来的花白头发，松弛的皮肤、苍老的面容，而忽略了机体整体的变化。因此，很多人把抗衰视为是对外貌的保养，于是水光针，玻尿酸、胶原蛋白等产品成为了保持年轻容颜的选择。医疗美容虽可延缓容颜的衰老，却不能改善衰老的身体症状，即便貌美如花也逆转不了精力减退、记忆力变差、抵抗力减弱、内脏器官机能衰退等衰老本质的进程。为了抵抗衰老，人们尝试着各种各样的方法，如今，干细胞抗老也受到了大家的关注，但是，干细胞真的能抗衰老吗？目前干细胞治疗衰老及衰老相关疾病成果也十分丰富，比如：（1）骨髓间充质干细胞移植被用于改善衰老虚弱症状（2）改善神经退行性疾病在衰老过程中，几乎所有的大脑都会发生特征性变化，包括脑萎缩、神经元和突触连接的丧失。这些与年龄相关的变化导致与神经变性相关的神经元活性下降和突触功能障碍。（3）改善年龄相关性黄斑变性年龄相关性黄斑变性，又称为老年性黄斑变性,是黄斑区结构的病理性衰老改变，是一种不可逆性的威胁老年人视力的疾病",,,,"科技,干细胞",0,0,0,2022/9/6 23:05,HUAWEI Mate 8,,,
4.81084E+15,M4xXm69qt,7646624789,晴晴看教育,#3d生物打印##科技#生物3D打印是3D打印技术革命中非常新奇有趣的一个应用，但到目前为止我们仍然几乎无法制备具有生理功能并且可以长期存活的复杂组织。不过，从中国科学院遗传与发育生物学研究所和清华大学传来了喜讯，两家单位的联合研究团队突破了相关技术瓶颈，成功打印出具有体外活性的心肌组织。该成果已于今年2月在线发表。生物3D打印是利用3D打印机，将含有细胞、生长因子和生物材料的生物墨水打印出仿生组织结构的新兴技术。这项技术都有哪些值得探讨的地方，中国科学家们又取得了怎样的突破，一起来看看吧。医疗行业从2014年开始集中关注器官组织的3D打印技术，其中最为人所知的主要是利用金属、陶瓷、塑料等材料制成填充物，修复骨骼等坚硬的人体部分。此外，3D打印技术还可以制成心脏等脏器的硅胶模型，以便外科医生在正式手术前研究疗法或进行演练。之后，随着生物3D打印技术的发展，如何选择合适的材料和工艺，实现打印皮肤、眼角膜这些既需要生物相容性、也对柔软度和韧性有较高要求的组织和器官，成为了如今的研究热点。与此同时，生物墨水这一新概念也逐渐走进了大家的视野。能否打印出人体器官组织，最关键的技术之一便是用于3D打印的原材料，也就是生物墨水。在目前的生物3D打印技术中，单独的细胞本身无法充当打印材料，因此需要一些特殊的物质，作为支撑细胞存活的基质。基质与细胞融合后，混合物再从打印机的喷头中喷射出来用于打印，这种混合物便是生物墨水（有时生物墨水也单指基质本身）。根据制法、原料的不同，生物墨水的性能也不尽相同，但成分来说大多是含有干细胞的水凝胶。以胶原、明胶、玻尿酸、褐藻酸以及纳米植物细胞等生物聚合体作为基础的生物墨水，具有良好的生物相容性，同时容易进行3D打印。打印出的构造可以模仿真实的细胞间基质，这也让打印复杂的立体组织结构成为可能。,,,,"3d生物打印,科技",0,0,0,2022/9/6 23:05,HUAWEI Mate 8,['https://wx3.sinaimg.cn/large/008luspTgy1h5xa9x1qhbj30ii0dw0tm.jpg'],,
4.81083E+15,M4xQ1jbpN,1286293690,孙永杰,土耳其捐赠的BMCKirpi防雷埋伏防护车在赫尔松地区战斗中成功拯救乌军士兵生命！#俄乌局势最新进展##军事##科技##防雷埋伏防护车##赫尔松#L孙永杰的微博视频,,,,"俄乌局势最新进展,军事,科技,防雷埋伏防护车,赫尔松",0,0,1,2022/9/6 22:47,微博视频号,,"http://f.video.weibocdn.com/o0/9ysjvPT7lx07Z0zPGTt601041200BdVb0E010.mp4?label=mp4_720p&template=1280x720.25.0&ori=0&ps=1BVp4ysnknHVZu&Expires=1665146293&ssig=btTKq%2BlY%2Fa&KID=unistore,video",
4.81083E+15,M4xNNzZSh,5993403508,手是好东西,#涨知识##科技#飞机应急滑梯为什么打开一次维护成本动辄就要十几万？L手是好东西的微博视频,,,,"涨知识,科技",0,0,1,2022/9/6 22:41,微博视频号,,"http://f.video.weibocdn.com/o0/HwR1Oemflx07Z0ffaEWc01041200y7qV0E010.mp4?label=mp4_720p&template=1024x576.25.0&ori=0&ps=1BVp4ysnknHVZu&Expires=1665146293&ssig=RU5Oa%2B1fSg&KID=unistore,video",
4.81083E+15,M4xGT8osg,5714719345,Oneline科技,不敢相信！原来罗永浩说的这位大佬是雷军啊！之前，罗永浩接受采访时曾很后悔的说：“2016年，还有一个做产品出身的科技大佬一度想收购我们，所以总找我聊天，想加深了解，这个人你们其实都认识，他以自己的血泪经验给我忠告说，我们这种产品经理型的创业者，最容易犯的错误就是不信机遇，不信风口总觉得老子产品比你们??，晚出来也一样会弄翻你们，我以前就是我以前就是这样，但这个真实的商业世界不是这样运转的。”后来罗永浩才明白过来，这些执念和盲目自信，也只有倒闭之后才能让自己清醒。第一次看这段话真不知道是哪个大佬说的，后来才知道这是小米CEO雷军说的，其实熟悉雷军的都知道，创办小米之前，雷军也经历过很多阵痛期，而且有的项目还是快成功了，就失败了。不断翻来覆去的坚持才有今天中国100强的小米。像之前的卓越网、米聊、三色公司，风投一系列潜力公司，直到现在的小米和第二次创业-小米汽车，不能说不精彩吧，也是有很多坎坷的，供应链问题、产能问题、芯片问题、散热问题、设计问题、等等问题都是罗永浩没面对过的，估计整个科技圈也就雷军能把罗永浩说服了吧？哦对了，以上雷军这些经历都是看《小米的创业思考》才知道的，写的确实详细。对此你们怎么看？#数码资讯##科技#,,,,"数码资讯,科技",1,6,14,2022/9/6 22:24,iPhone 13,['https://wx3.sinaimg.cn/large/006eKnyFly1h5x93oq3vij30hs0hsjse.jpg'],,
4.81082E+15,M4xyJ2cdo,5714719345,Oneline科技,盘点全球上市公司市值前十名：第一名：苹果公司，总市值2.45万亿美元第二名：沙特阿美，总市值2.17万亿美元第三名：微软，总市值1.95万亿美元第四名：谷歌，总市值1.46万亿美元第五名：亚马逊，总市值1.3万亿美元第六名：特斯拉，总市值8685亿美元第七名：伯克希尔，总市值6226亿美元第八名：联合健康，总市值4916亿美元第九名：FaceBook，总市值4444亿美元第十名：强生，总市值4347亿美元可以看到，这是家公司市值都出奇的高，除了沙特阿美以外，其余的都是美国公司。其中最值得说的就是巴菲特的伯克希尔哈撒韦，42.42万美元的股价虽然是全球之最，但二季度却亏损严重，暴跌3000亿后的巴菲特会不会正是借此机会抽身比亚迪疯狂回血呢？也说不准。但这份榜单中却未见中国企业，像咱们的比亚迪、台积电、腾讯控股、阿里巴巴、宁德时代其实都是有机会登顶的，只要再努努力就可以了，不过也有网友说让贵州茅台上去，我对此表示很无语…对此你们怎么看？#数码资讯##科技#,,,,"数码资讯,科技",0,5,19,2022/9/6 22:04,iPhone 13,"['https://wx3.sinaimg.cn/large/006eKnyFly1h5x8ip094kj30u00k0q3j.jpg', 'https://wx3.sinaimg.cn/large/006eKnyFly1h5x8iquv37g30hs09ykjt.jpg', 'https://wx1.sinaimg.cn/large/006eKnyFly1h5x8iouj0oj30u00mi10q.jpg']",,
4.81082E+15,M4xxylH9A,6001150714,钢芯铁钻,采摘源源不断，一个夏天，柿子椒，紫扁豆，西红柿?，自给自足。科技助力器械农业，农业经济将成为腾飞助力器。#就在这一刻##科技##科普一下#,,,,"就在这一刻,科技,科普一下",0,0,0,2022/9/6 22:01,华为手机,"['https://wx2.sinaimg.cn/large/006y8drsgy1h5x8fcs2ypj327v1nwnpd.jpg', 'https://wx3.sinaimg.cn/large/006y8drsgy1h5x8fe4azzj32a31pk4qp.jpg']",,
4.81082E+15,M4xprFqyB,5993403508,手是好东西,#涨知识##科技#心脏支架长啥样？它是怎么被放入人体的...L手是好东西的微博视频,,,,"涨知识,科技",2,0,1,2022/9/6 21:41,微博视频号,,"http://f.video.weibocdn.com/o0/LQwkh7uylx07Z03kaeSI01041200r3xW0E010.mp4?label=mp4_720p&template=1024x576.25.0&ori=0&ps=1BVp4ysnknHVZu&Expires=1665146293&ssig=m6TWgmKZWA&KID=unistore,video",
4.81082E+15,M4xmlz3sv,5714719345,Oneline科技,我们要向柳传志学习！向联想致敬！联想作为中国自主研发高科技制造企业，拥有全球强大供应链及技术资源，PC销量全球领先，抗起了中国制造业大旗，树立百年历史丰碑，柳传志贡献功不可没！他的传奇一生，有无数个传奇闪光点，既给我们带来的创业的启发，又给我们带来了自主研发，支持5G国货的信心及动力，是我们终身学习的信念和标杆！他是学生、小孩学习的榜样，也是时代所敬仰的楷模，是他把中国高科技制造业带到了世界之巅，也是他把一众国产厂商引入了自主研发的道路上，这样的民族英雄值得我们每一个人学习和致敬，他配的上这份殊荣与称赞…吗？对此你们怎么看？#数码资讯##科技#,,,,"数码资讯,科技",0,12,16,2022/9/6 21:34,iPhone 13,"['https://wx2.sinaimg.cn/large/006eKnyFly1h5x7mzzq76j30dw099gm4.jpg', 'https://wx2.sinaimg.cn/large/006eKnyFly1h5x7n0ayr5j30to0ppwnc.jpg', 'https://wx4.sinaimg.cn/large/006eKnyFly1h5x7n0jwbqj30zk0qo0zu.jpg', 'https://wx2.sinaimg.cn/large/006eKnyFly1h5x7n1pvufj30tu187dit.jpg']",,
4.81081E+15,M4xjntBBg,5714719345,Oneline科技,真的找不到不支持华为的理由问界M5EV订单量已突破3w#汽车##科技#,,,,"汽车,科技",0,2,9,2022/9/6 21:26,iPhone 13,"['https://wx1.sinaimg.cn/large/006eKnyFly1h5x7ffepjxj30cqcm77wk.jpg', 'https://wx2.sinaimg.cn/large/006eKnyFly1h5x7fdsjq6j30u0149n4j.jpg']",,
4.81049E+15,M4oOZyFGF,5499828210,楚雪琪雨,#那年今日##科学##科技#来源：SCI-HUB科学技术史上的今天-9月5日1925年9月5日，德国地球化学家诺达克和泰开夫妇于在纽伦堡的德国化学家联合会上宣布，他们发现了一种新元素，并展示了该元素化合物的样品。这是最后一个被发现的天然元素，被命名为“铼”。1977年9月5日，美国成功发射“旅行者-1号”探测器，该探测器的目标是太阳系九大行星中的木星和土星。1980年9月5日，世界上最长的公路遂道――圣哥大隧道正式通车。圣哥大隧道位于瑞士东南部的阿尔卑斯山脉之中，全长16.3公里，为双向通车道，它是1969年秋天开始动工修建的。1981年9月5日，我国最大天文台――紫金山天文台首次拍下了太阳白耀斑的整套光谱资料。1986年9月5日，我国科学家第一次证实动物同人体一样存在着经络系统。,,,,"科学,科技",0,0,0,2022/9/5 23:50,Note 9 Pro 一亿像素,,,
4.81048E+15,M4oAaAY2g,5213866791,百事可乐Pan,不得不夸夸我家#海信真空冰箱#415储鲜功能杠杠滴！???这款冰箱采用真空休眠技术，能让食材处于休眠状态，降低食材的氧化反应，可以储存水润多汁的当季水果、鲜绿挺实的健康蔬菜和营养满满的蛋奶制品??！还使用VIP真空绝热板让储鲜空间大大增加，不论你是“肉食动物”还是“甜品控”，都能有充足的空间来存储美食，足够大的空间才装得下足够多的心意~冷冻保存的羊排肥瘦比例恰到好处，既能体会到羊肉的肥美，又不会有油腻之感?嘴馋了，马上安排一顿家庭牛排大餐?瞧一瞧，色泽金黄，香酥入味，肥而不腻，外表金黄油亮，焦黄发脆，里面的肉绵软鲜嫩，羊肉味清香扑鼻很难叫人不爱啊！???#真空・才是真保鲜##海信真空冰箱##保鲜##科技##除菌#L百事可乐Pan的微博视频,,,,"海信真空冰箱,真空・才是真保鲜,保鲜,科技,除菌",1,1,2,2022/9/5 23:13,iPhone客户端,,"http://f.video.weibocdn.com/o0/4fPvJEBWlx07YZ0JNS6I0104120083r50E010.mp4?label=mp4_720p&template=720x1280.24.0&ori=0&ps=1BVp4ysnknHVZu&Expires=1665146305&ssig=Eb15mua20e&KID=unistore,video",
4.81048E+15,M4ozmkQ1C,5213866791,百事可乐Pan,不得不夸夸我家#海信真空冰箱#储鲜功能杠杠滴，这款冰箱采用真空休眠技术，能让食材处于休眠状态，降低食材的氧化反应，可以储存水润多汁的当季水果、鲜绿挺实的健康蔬菜和营养满满的蛋奶制品。还使用VIP真空绝热板让储鲜空间大大增加，不论你是“肉食动物”还是“甜品控”，都能有充足的空间来存储美食，足够大的空间才装得下足够多的心意~冷冻保存的羊排肥瘦比例恰到好处，既能体会到羊肉的肥美，又不会有油腻之感！嘴馋了，马上安排一顿家庭牛排大餐瞧一瞧，色泽金黄，香酥入味，肥而不腻，外表金黄油亮，焦黄发脆，里面的肉绵软鲜嫩，羊肉味清香扑鼻很难叫人不爱啊！！#保鲜##真空・才是真保鲜##海信真空冰箱##科技##除菌#L百事可乐Pan的微博视频,,,,"海信真空冰箱,保鲜,真空・才是真保鲜,科技,除菌",0,1,3,2022/9/5 23:11,iPhone客户端,,"http://f.video.weibocdn.com/o0/9ACQXY04lx07YZ0BNvDa010412006z4l0E010.mp4?label=mp4_720p&template=720x1280.24.0&ori=0&ps=1BVp4ysnknHVZu&Expires=1665146305&ssig=Iqsb4%2BQQ7T&KID=unistore,video",
4.81047E+15,M4ojAkyfD,5379161953,北京创行智能团队,#3d生物打印##科技#生物3D打印是3D打印技术革命中非常新奇有趣的一个应用，但到目前为止我们仍然几乎无法制备具有生理功能并且可以长期存活的复杂组织。不过，从中国科学院遗传与发育生物学研究所和清华大学传来了喜讯，两家单位的联合研究团队突破了相关技术瓶颈，成功打印出具有体外活性的心肌组织。该成果已于今年2月在线发表。生物3D打印是利用3D打印机，将含有细胞、生长因子和生物材料的生物墨水打印出仿生组织结构的新兴技术。这项技术都有哪些值得探讨的地方，中国科学家们又取得了怎样的突破，一起来看看吧。医疗行业从2014年开始集中关注器官组织的3D打印技术，其中最为人所知的主要是利用金属、陶瓷、塑料等材料制成填充物，修复骨骼等坚硬的人体部分。此外，3D打印技术还可以制成心脏等脏器的硅胶模型，以便外科医生在正式手术前研究疗法或进行演练。之后，随着生物3D打印技术的发展，如何选择合适的材料和工艺，实现打印皮肤、眼角膜这些既需要生物相容性、也对柔软度和韧性有较高要求的组织和器官，成为了如今的研究热点。与此同时，生物墨水这一新概念也逐渐走进了大家的视野。能否打印出人体器官组织，最关键的技术之一便是用于3D打印的原材料，也就是生物墨水。在目前的生物3D打印技术中，单独的细胞本身无法充当打印材料，因此需要一些特殊的物质，作为支撑细胞存活的基质。基质与细胞融合后，混合物再从打印机的喷头中喷射出来用于打印，这种混合物便是生物墨水（有时生物墨水也单指基质本身）。根据制法、原料的不同，生物墨水的性能也不尽相同，但成分来说大多是含有干细胞的水凝胶。以胶原、明胶、玻尿酸、褐藻酸以及纳米植物细胞等生物聚合体作为基础的生物墨水，具有良好的生物相容性，同时容易进行3D打印。打印出的构造可以模仿真实的细胞间基质，这也让打印复杂的立体组织结构成为可能。,,,,"3d生物打印,科技",0,0,0,2022/9/5 22:32,HUAWEI Mate 8,['https://wx4.sinaimg.cn/large/005S2pKFgy1h5w3pkyf6dj30fe0aajtk.jpg'],,
4.81047E+15,M4ohhf3XT,1783631265,机械科技,仿生机械手臂抓取柔软的糕点#科技##仿生学#L机械科技的微博视频,,,,"科技,仿生学",33,9,37,2022/9/5 22:27,机械科技的HarmonyOS Device,,"http://f.video.weibocdn.com/o0/FACQTf4Dlx07YYXyJEPm01041200abGx0E010.mp4?label=mp4_720p&template=1080x608.25.0&ori=0&ps=1BVp4ysnknHVZu&Expires=1665146305&ssig=t6GNiRXNOc&KID=unistore,video",
4.81046E+15,M4oaht7yg,5714719345,Oneline科技,这才叫良心企业！所有高管同频共振，上身西装，下身牛仔裤+运动裤，好像自从小米创立以来，所有小米高管都是这一身装扮，印象中乔布斯在世时也这样穿，仅从这么多年统一装扮，就能看到小米的凝聚力和战斗力。然而，小米的创办却不是一帆风顺的，这几天一直在看《小米的创业思考》，看到雷军刚创办小米时真的相当难，虽然有好口碑，但供应链问题相当难解决，一度几年时间都是饥饿营销，其实是真的没货，现在大家再看看，小米的货是相当充足，而且质量也很高，只能说这些年雷军在供应链问题上真的下足了功夫、吃了很多苦头，记得当年黑着脸去三星求原谅就觉得有些难以面对，雷军真的是经历过大事儿的，各位高端也是如此，所以才能穿着这么统一，战斗力非常凝聚，小米这家公司，前途无量啊！对此你们怎么看？#数码资讯##科技#,,,,"数码资讯,科技",0,14,33,2022/9/5 22:09,iPhone 13,['https://wx2.sinaimg.cn/large/006eKnyFly1h5w1qj6pl5j30zk0np1kx.jpg'],,
